<?xml version="1.0" encoding="UTF-8"?>
<!DOCTYPE source SYSTEM "file://ad.ucl.ac.uk/homed/uczctsd/DesktopSettings/Desktop/XML%20East%20India%20Company/DTD/EastIndiaCompany.dtd">
<source>
    <text index="SURAT" pages="801">
        <sourceDesc><doctype ID="1" system="British">PROCLAMATION</doctype>, BY THE <person><rank>HON’BLE</rank> <name ID="5">JONATHAN DUNCAN</name>, <role>GOVERNOR OF BOMBAY</role></person>. DATED <place type="city" lang="hindi">SURAT</place>, THE <date calendar="gregorian"><day>15</day>TH <month>MAY</month> <year>1800</year></date></sourceDesc>
        <maintext>
            <prose>
                <p>Whereas by a Treaty concluded between the <politicalEntity>Hon’ble English Company</politicalEntity> and the <person><rank lang="hindi" altspell1="nawab">Nuwab</rank> <rank lang="hindi">Meer</rank> <name ID="8" lang="hindi">Nuseer-ood-Deen Khan</name></person>, under the date the <date calendar="gregorian"><day>13</day>th <month>May</month> <year>1800</year></date>, or the <date calendar="islamic"><day>19</day>th of <month lang="arabic">Zilhuj</month> <year>1214</year> of the <era lang="arabic">Hijree</era></date>, the said <rank lang="hindi" altspell1="nawab">Nuwab</rank> has agreed that the management and collection of the Revenues of the City of <place type="city" lang="hindi" >Surat</place>, and of the Territories, Places, and other Dependencies thereof, the administration of civil and criminal justice, and generally the entire government of the said City and its Dependencies, hall be vested forever, wholly and exclusively in the <politicalEntity>Hon’ble English Company</politicalEntity>;</p>
                <p>This is therefore to give notice to all the inhabitants of the Town of <place lang="hindi" type="city">Surat</place> and its Dependencies, that the <politicalEntity>Hon’ble Company</politicalEntity>’s exclusive Government commences from this day, being <date calendar="gregorian"><weekday>Thursday</weekday>, the <day>15</day>th of <month>May</month> <year>1800</year></date>. Or the <date calendar="islamic"><day>21</day>st of <month lang="arabic">Zilhuj</month> <year>1214</year> of the <era lang="arabic">Hijree</era></date>.  All persons now in civil offices are to continue to act under the administration of the <politicalEntity>Hon’ble Company</politicalEntity> until further orders, and under their future permanency will, of course, in a great measure, depend, under the good pleasure of Government, upon their diligence in their several trusts, and their fidelity to the <politicalEntity lang="mixed">English Sirkar</politicalEntity>.</p>
                <p><person><name ID="6">Edward Galley</name>, <rank>Esquire</rank>, has been appointed <role>Collector</role> of the <nonEW lang="hindi" type="unknown">Mokat</nonEW>s and <nonEW type="unknown">Mogalee</nonEW> of the <politicalEntity lang="hindi">Purgunas</politicalEntity></person>, and <person><name ID="9">Alexander Ramsay</name>, <rank>Esquire</rank>, <role>Judge</role> and <role>Magistrate</role> of the city</person>.  The Natives in trust in these <politicalEntity>Departments</politicalEntity> are therefore respectively to continue to act in subordination to those superior <role>Officers</role>, and such appointments or regulations as may take place will be announced in a few days, it being sufficient for the present to intimate to all the Company’s New Subjects of Surat, that the motives and object of the <politicalEntity>British Government</politicalEntity> in taking on themselves the full and entire government of <place lang="hindi" type="city">Surat</place>, have been, and are, to procure thereby a just, wise, and efficient administration for the security of the lives and properties, and the promotion of the happiness of all its inhabitants, of which, with God’s blessing, the good effects may soon be rendered manifest.</p>
            </prose>
        </maintext>
        <datePlace>
            <date calendar="gregorian"><day>15</day>th <month>May</month> <year>1800</year>.</date>
            <place type="castle">Surat Castle</place>
        </datePlace>
        <image src=""/>
    </text>
</source>
